{
  "id": "uk-data-residency-v1",
  "version": "1.0.0",
  "title": "United Kingdom Data Residency Baseline (UK GDPR + DPA 2018)",
  "jurisdiction": "United Kingdom",
  "updated": "2026-07-05",
  "notes": "Constrains placement to UK cloud regions and evidences the UK GDPR and the Data Protection Act 2018. Post-Brexit the UK GDPR retains GDPR article numbering. Evidence of technical/organizational controls, not a cryptographic data-path proof.",
  "regions": [
    "eu-west-2",
    "europe-west2",
    "uksouth",
    "ukwest"
  ],
  "rules": [
    {
      "rule_id": "eu-region-placement",
      "name": "Workloads pinned to a UK region",
      "description": "Every workload declares node placement constrained to an allow-listed UK cloud region (London) via topology.kubernetes.io/region.",
      "severity": "high",
      "rationale": "Placement outside the UK can transfer personal data to a third country without an appropriate safeguard under the UK GDPR.",
      "articles": [
        { "regulation": "UK GDPR", "article": "Art. 44", "title": "General principle for transfers", "url": "https://www.legislation.gov.uk/eur/2016/679/article/44" },
        { "regulation": "DPA 2018", "article": "Part 2", "title": "General processing", "url": "https://www.legislation.gov.uk/ukpga/2018/12/part/2" }
      ]
    },
    {
      "rule_id": "no-non-eu-egress",
      "name": "No unrestricted or extra-territorial egress",
      "description": "Services do not proxy to external endpoints (ExternalName) and NetworkPolicies do not permit unrestricted (0.0.0.0/0, ::/0) egress.",
      "severity": "high",
      "rationale": "Open egress can move personal data outside the UK without a transfer safeguard.",
      "articles": [
        { "regulation": "UK GDPR", "article": "Art. 44", "title": "General principle for transfers", "url": "https://www.legislation.gov.uk/eur/2016/679/article/44" },
        { "regulation": "UK GDPR", "article": "Art. 46", "title": "Transfers subject to appropriate safeguards", "url": "https://www.legislation.gov.uk/eur/2016/679/article/46" }
      ]
    },
    {
      "rule_id": "customer-managed-key",
      "name": "Storage uses customer-managed keys",
      "description": "PersistentVolumeClaims reference a customer-managed key (CMK) so the controller controls the keys.",
      "severity": "medium",
      "rationale": "Customer-managed keys reduce provider access to plaintext and strengthen the sovereignty posture.",
      "articles": [
        { "regulation": "UK GDPR", "article": "Art. 32", "title": "Security of processing", "url": "https://www.legislation.gov.uk/eur/2016/679/article/32" }
      ]
    },
    {
      "rule_id": "encryption-at-rest",
      "name": "Encryption at rest declared",
      "description": "PersistentVolumeClaims declare encryption at rest via the configured label/annotation.",
      "severity": "medium",
      "rationale": "Encryption at rest is a baseline technical measure under the security-of-processing obligation.",
      "articles": [
        { "regulation": "UK GDPR", "article": "Art. 32", "title": "Security of processing", "url": "https://www.legislation.gov.uk/eur/2016/679/article/32" }
      ]
    }
  ]
}
